<?xml version="1.0" encoding="UTF-8"?>
<tns:medicines xmlns:tns="Medicines" xmlns:xsi="http://www.w3.org/2001/XMLSchema-instance" xsi:schemaLocation="Medicines MedsShemaXMLS.xsd ">
	<!-- MEDICINE 1 -->
	<tns:medicine tns:id="i1">   
		<tns:name>IBUPROFEN</tns:name>
		<tns:pharm>MINSK-PHARM</tns:pharm>
		<tns:group>Non-narcotic analgesics</tns:group>
		<tns:analogs>
			<tns:analog>IBUPROFEN-MAX</tns:analog>
			<tns:analog>IBUPROFEN-SUPER-MAX</tns:analog>
		</tns:analogs>
		<tns:versions>
			<tns:version tns:distribution-version="pills">
 				<tns:certificate>
 					<tns:certificate-number>1000000000</tns:certificate-number>
 					<tns:certificate-issued-date-time>2020-01-01T00:00:00</tns:certificate-issued-date-time>
 					<tns:certificate-expires-date-time>2025-01-01T00:00:00</tns:certificate-expires-date-time>
 					<tns:certificate-registered-organization>Minzdrav</tns:certificate-registered-organization>
 				</tns:certificate>
 				<tns:package>
 					<tns:package-type>cell packaging</tns:package-type>
 					<tns:package-elements-count-in>10</tns:package-elements-count-in>
 					<tns:package-price>1</tns:package-price>
 				</tns:package>
 				<tns:dosage>
 					<tns:dosage-active-agent>50</tns:dosage-active-agent>
 					<tns:dosage-maximum-use-per-day>5</tns:dosage-maximum-use-per-day>
 				</tns:dosage>
			</tns:version>
		</tns:versions>
	</tns:medicine>
	
	<!-- MEDICINE 2 -->
	<tns:medicine tns:id="i2">   
		<tns:name>Aleffke</tns:name>
		<tns:pharm>MINSK-PHARM</tns:pharm>
		<tns:group>Homeopathic medicines</tns:group>
		<tns:analogs>
			<tns:analog>Aleffke-MAX</tns:analog>
		</tns:analogs>
		<tns:versions> 
			<tns:version tns:distribution-version="pills">
 				<tns:certificate>
 					<tns:certificate-number>1000000002</tns:certificate-number>
 					<tns:certificate-issued-date-time>2020-01-01T00:00:00</tns:certificate-issued-date-time>
 					<tns:certificate-expires-date-time>2025-01-01T00:00:00</tns:certificate-expires-date-time>
 					<tns:certificate-registered-organization>Minzdrav</tns:certificate-registered-organization>
 				</tns:certificate>
 				<tns:package>
 					<tns:package-type>cell packaging</tns:package-type>
 					<tns:package-elements-count-in>10</tns:package-elements-count-in>
 					<tns:package-price>1</tns:package-price>
 				</tns:package>
 				<tns:dosage>
 					<tns:dosage-active-agent>50</tns:dosage-active-agent>
 					<tns:dosage-maximum-use-per-day>5</tns:dosage-maximum-use-per-day>
 				</tns:dosage>
			</tns:version>
			<tns:version tns:distribution-version="capsules">
 				<tns:certificate>
 					<tns:certificate-number>1000000003</tns:certificate-number>
 					<tns:certificate-issued-date-time>2020-01-01T00:00:00</tns:certificate-issued-date-time>
 					<tns:certificate-expires-date-time>2025-01-01T00:00:00</tns:certificate-expires-date-time>
 					<tns:certificate-registered-organization>Minzdrav</tns:certificate-registered-organization>
 				</tns:certificate>
 				<tns:package>
 					<tns:package-type>jar</tns:package-type>
 					<tns:package-elements-count-in>30</tns:package-elements-count-in>
 					<tns:package-price>10</tns:package-price>
 				</tns:package>
 				<tns:dosage>
 					<tns:dosage-active-agent>50</tns:dosage-active-agent>
 					<tns:dosage-maximum-use-per-day>5</tns:dosage-maximum-use-per-day>
 				</tns:dosage>
			</tns:version>
		</tns:versions>
	</tns:medicine>
	
		<!-- MEDICINE 3 -->
	<tns:medicine tns:id="i3">   
		<tns:name>ILKffk</tns:name>
		<tns:pharm>MINSK-PHARM</tns:pharm>
		<tns:group>Hormones and their antagonists</tns:group>
		<tns:analogs>
		</tns:analogs>
		<tns:versions> 
			<tns:version tns:distribution-version="pills">
 				<tns:certificate>
 					<tns:certificate-number>1000000004</tns:certificate-number>
 					<tns:certificate-issued-date-time>2020-01-01T00:00:00</tns:certificate-issued-date-time>
 					<tns:certificate-expires-date-time>2021-01-01T00:00:00</tns:certificate-expires-date-time>
 					<tns:certificate-registered-organization>Minzdrav</tns:certificate-registered-organization>
 				</tns:certificate>
 				<tns:package>
 					<tns:package-type>ampoules</tns:package-type>
 					<tns:package-elements-count-in>20</tns:package-elements-count-in>
 					<tns:package-price>2</tns:package-price>
 				</tns:package>
 				<tns:dosage>
 					<tns:dosage-active-agent>60</tns:dosage-active-agent>
 					<tns:dosage-maximum-use-per-day>4</tns:dosage-maximum-use-per-day>
 				</tns:dosage>
			</tns:version>
		</tns:versions>
	</tns:medicine>
	
		<!-- MEDICINE 4 -->
	<tns:medicine tns:id="i4">   
		<tns:name>IBUPOF</tns:name>
		<tns:pharm>BREST-PHARM</tns:pharm>
		<tns:group>Non-narcotic analgesics</tns:group>
		<tns:analogs>
			<tns:analog>IBUPOF-MAX</tns:analog>
		</tns:analogs>
		<tns:versions> 
			<tns:version tns:distribution-version="pills">
 				<tns:certificate>
 					<tns:certificate-number>1000000005</tns:certificate-number>
 					<tns:certificate-issued-date-time>2020-01-01T00:00:00</tns:certificate-issued-date-time>
 					<tns:certificate-expires-date-time>2025-01-01T00:00:00</tns:certificate-expires-date-time>
 					<tns:certificate-registered-organization>Minzdrav</tns:certificate-registered-organization>
 				</tns:certificate>
 				<tns:package>
 					<tns:package-type>syringe</tns:package-type>
 					<tns:package-elements-count-in>1</tns:package-elements-count-in>
 					<tns:package-price>100</tns:package-price>
 				</tns:package>
 				<tns:dosage>
 					<tns:dosage-active-agent>500</tns:dosage-active-agent>
 					<tns:dosage-maximum-use-per-day>1</tns:dosage-maximum-use-per-day>
 				</tns:dosage>
			</tns:version>
		</tns:versions>
	</tns:medicine>
	
		<!-- MEDICINE 6 -->
	<tns:medicine tns:id="i5">   
		<tns:name>Sweets</tns:name>
		<tns:pharm>MINSK-Sweet-PHARM</tns:pharm>
		<tns:group>Biologically active food additives</tns:group>
		<tns:analogs>
			<tns:analog>Sweets-MAX</tns:analog>
			<tns:analog>Sweets-Super-MAX</tns:analog>
		</tns:analogs>
		<tns:versions> 
			<tns:version tns:distribution-version="pills">
 				<tns:certificate>
 					<tns:certificate-number>1000000006</tns:certificate-number>
 					<tns:certificate-issued-date-time>2020-01-01T00:00:00</tns:certificate-issued-date-time>
 					<tns:certificate-expires-date-time>2025-01-01T00:00:00</tns:certificate-expires-date-time>
 					<tns:certificate-registered-organization>Minzdrav</tns:certificate-registered-organization>
 				</tns:certificate>
 				<tns:package>
 					<tns:package-type>cell packaging</tns:package-type>
 					<tns:package-elements-count-in>10</tns:package-elements-count-in>
 					<tns:package-price>1</tns:package-price>
 				</tns:package>
 				<tns:dosage>
 					<tns:dosage-active-agent>500</tns:dosage-active-agent>
 					<tns:dosage-maximum-use-per-day>100</tns:dosage-maximum-use-per-day>
 				</tns:dosage>
			</tns:version>
			<tns:version tns:distribution-version="powder">
 				<tns:certificate>
 					<tns:certificate-number>1000000007</tns:certificate-number>
 					<tns:certificate-issued-date-time>2020-01-01T00:00:00</tns:certificate-issued-date-time>
 					<tns:certificate-expires-date-time>2025-01-01T00:00:00</tns:certificate-expires-date-time>
 					<tns:certificate-registered-organization>Minzdrav</tns:certificate-registered-organization>
 				</tns:certificate>
 				<tns:package>
 					<tns:package-type>aluminum tubes</tns:package-type>
 					<tns:package-elements-count-in>100</tns:package-elements-count-in>
 					<tns:package-price>100</tns:package-price>
 				</tns:package>
 				<tns:dosage>
 					<tns:dosage-active-agent>500</tns:dosage-active-agent>
 					<tns:dosage-maximum-use-per-day>100</tns:dosage-maximum-use-per-day>
 				</tns:dosage>
			</tns:version>
		</tns:versions>
	</tns:medicine>
	
		<!-- MEDICINE 6 -->
	<tns:medicine tns:id="i6">   
		<tns:name>Lafafa</tns:name>
		<tns:pharm>Paris-PHARM</tns:pharm>
		<tns:group>Diagnostic medicines</tns:group>
		<tns:analogs>
			<tns:analog>Lafafa-MAX</tns:analog>
		</tns:analogs>
		<tns:versions> 
			<tns:version tns:distribution-version="pills">
 				<tns:certificate>
 					<tns:certificate-number>1000000008</tns:certificate-number>
 					<tns:certificate-issued-date-time>2020-01-01T00:00:00</tns:certificate-issued-date-time>
 					<tns:certificate-expires-date-time>2025-01-01T00:00:00</tns:certificate-expires-date-time>
 					<tns:certificate-registered-organization>ParMinzdrav</tns:certificate-registered-organization>
 				</tns:certificate>
 				<tns:package>
 					<tns:package-type>bottle</tns:package-type>
 					<tns:package-elements-count-in>10</tns:package-elements-count-in>
 					<tns:package-price>1</tns:package-price>
 				</tns:package>
 				<tns:dosage>
 					<tns:dosage-active-agent>50</tns:dosage-active-agent>
 					<tns:dosage-maximum-use-per-day>5</tns:dosage-maximum-use-per-day>
 				</tns:dosage>
			</tns:version>
		</tns:versions>
	</tns:medicine>
	
		<!-- MEDICINE 7 -->
	<tns:medicine tns:id="i7">   
		<tns:name>IBUPROJEN</tns:name>
		<tns:pharm>MINSK-PHARM</tns:pharm>
		<tns:group>Neurotropic medicines</tns:group>
		<tns:analogs>
			<tns:analog>IBUPROJEN-MAX</tns:analog>
		</tns:analogs>
		<tns:versions> 
			<tns:version tns:distribution-version="pills">
 				<tns:certificate>
 					<tns:certificate-number>1000000009</tns:certificate-number>
 					<tns:certificate-issued-date-time>2020-01-01T00:00:00</tns:certificate-issued-date-time>
 					<tns:certificate-expires-date-time>2025-01-01T00:00:00</tns:certificate-expires-date-time>
 					<tns:certificate-registered-organization>Minzdrav</tns:certificate-registered-organization>
 				</tns:certificate>
 				<tns:package>
 					<tns:package-type>ampoules</tns:package-type>
 					<tns:package-elements-count-in>10</tns:package-elements-count-in>
 					<tns:package-price>2</tns:package-price>
 				</tns:package>
 				<tns:dosage>
 					<tns:dosage-active-agent>100</tns:dosage-active-agent>
 					<tns:dosage-maximum-use-per-day>1</tns:dosage-maximum-use-per-day>
 				</tns:dosage>
			</tns:version>